333190,https://www.airbnb.com/rooms/333190,20240615011618,2024-06-15,city scrape,Super location! by months,,"we are in a privileged position within the city, out of the craziness of downtown but so close that if you like walking, you can walk to the main attractions of the city <br />The neighborhood is very safe and quiet, around there are plenty of supermarkets, bars, restaurants and so on.",https://a0.muscache.com/pictures/miso/Hosting-333190/original/affa2ec0-926f-4e84-9247-0bd3b6381f58.jpeg,1697782,https://www.airbnb.com/users/show/1697782,Joel,2012-02-04,"Barcelona, Spain","Vengo de la hermosa Patagonia, he vivido en distintos lugares del mundo y hace 10 años que he cumplido el sueño de radicarme en Barcelona, donde tengo un Piso con privilegiadas vistas y una inmejorable ubicación, el cual compàrto ocasionalmente con mas gente, viejos y nuevos amigos y amigas que vienen a quedarse por una temporada, Si hay tiempo llegaremos a conocernos un poco, y puedes contar conmigo para lo que necesites
Un saludo!
Jóse
I come from beautiful Patagonia, I have lived in different parts of the world and for the last 10 years I have fulfilled the dream of living in Barcelona, where I have an apartment with awesome views and an unbeatable location, which occasionally I share with more people, old and new friends who come for a short season to explore this beautiful city, if we have time we will get to know each other a little bit, will be a pleasure to help you with whatever you need
A greeting!
Jóse",within an hour,100%,100%,t,https://a0.muscache.com/im/pictures/user/04081462-1225-44aa-9222-e06f7961d85a.jpg?aki_policy=profile_small,https://a0.muscache.com/im/pictures/user/04081462-1225-44aa-9222-e06f7961d85a.jpg?aki_policy=profile_x_medium,el Fort Pienc,2,5,"['email', 'phone']",t,t,"Barcelona, Catalonia, Spain",el Fort Pienc,Eixample,41.40131,2.18191,Private room in rental unit,Private room,2,1.5,1.5 shared baths,1,1,"[""Host greets you"", ""Elevator"", ""Room-darkening shades"", ""Extra pillows and blankets"", ""Long term stays allowed"", ""Coffee maker"", ""Essentials"", ""Portable fans"", ""Toaster"", ""Blender"", ""Refrigerator"", ""Shampoo"", ""Hangers"", ""Fire extinguisher"", ""Conditioner"", ""Dishes and silverware"", ""Shower gel"", ""Laundromat nearby"", ""Ceiling fan"", ""Bed linens"", ""Body soap"", ""Wifi"", ""Coffee"", ""Paid parking off premises"", ""Microwave"", ""Hot water"", ""Lock on bedroom door""]",$63.00,3,60,3,4,60,60,3.1,60.0,,t,5,17,21,21,2024-06-15,281,46,3,2012-06-14,2024-06-01,4.81,4.91,4.82,4.9,4.91,4.87,4.8,Exempt,f,2,0,2,0,1.92
110041,https://www.airbnb.com/rooms/110041,20240615011618,2024-06-15,city scrape,002. Alió 2 Apartment,A spectacular newly constructed apartment having been built using the highest quality of materials.,,https://a0.muscache.com/pictures/24f2fe9f-61b6-4d84-b90e-3c1c4b9ceab9.jpg,396363,https://www.airbnb.com/users/show/396363,Alcam Apartments,2011-02-17,"Barcelona, Spain",We are Alcambarcelona. We love our work and are willing to be good hosts. Barcelona is a very active and I'm sure you love to enjoy the city awaits you in our apartments. Greetings from Barcelona:),within an hour,100%,91%,f,https://a0.muscache.com/im/pictures/user/61a1c62f-df6b-49d4-97aa-3edee5441069.jpg?aki_policy=profile_small,https://a0.muscache.com/im/pictures/user/61a1c62f-df6b-49d4-97aa-3edee5441069.jpg?aki_policy=profile_x_medium,La Sagrada Família,87,102,"['email', 'phone', 'work_email']",t,t,,el Camp d'en Grassot i Gràcia Nova,Gràcia,41.40271,2.16646,Entire rental unit,Entire home/apt,4,1.0,1 bath,1,2,"[""Kitchen"", ""Patio or balcony"", ""Crib"", ""Hair dryer"", ""Air conditioning"", ""Coffee maker"", ""Essentials"", ""Cooking basics"", ""Washer"", ""Noise decibel monitors on property"", ""Baby bath"", ""Refrigerator"", ""Pocket wifi"", ""Self check-in"", ""Freezer"", ""Luggage dropoff allowed"", ""Hangers"", ""Iron"", ""Dishes and silverware"", ""Laundromat nearby"", ""Bed linens"", ""Wifi"", ""Heating"", ""Dedicated workspace"", ""Hot water"", ""Oven"", ""Smart lock"", ""Microwave"", ""Electric stove"", ""TV"", ""Pets allowed""]",$94.00,1,1125,1,3,2,1125,1.6,810.8,,t,13,25,53,159,2024-06-15,61,22,1,2012-07-16,2024-05-16,4.15,4.28,4.21,4.13,4.38,4.66,4.08,HUTB-003671,f,66,66,0,0,0.42
112538,https://www.airbnb.com/rooms/112538,20240615011618,2024-06-15,city scrape,✨Design Apt near Sagrada Familia / Shared terrace✨,Have an authentic Barcelona experience! Modern 100m2 recently decorated apartment with balconies- definitely one to consider if you want to soak up the spanish sunshine during your stay. An incredible location + spacious and comfortable rooms - makes it a great place to kick back and relax after a day full of sightseeing and entertainment. It doesn’t matter if you are a group of friends who wants to meet the city or a family that would love to explore the local culture- it´s the place for you!,"Apartment is located just 240 meters from Sagrada Familia. Right on Avenida Gaudí, a cozy boulevard that leads from Sagrada Familia to Hospital de Sant Pau (which is another architectural wonder, a UNESCO World Heritage Site).<br />Eixample is one of the safest areas of Barcelona and at the same time has many restaurants, bars and nightclubs to enjoy, a large number of them are located on our street, where you can eat in one of the many restaurants or just sit on the avenue and enjoy local tapas. There are different environments found in this neighborhood of Barcelona, ​​from the most traditional and Catalan to a young and art-filled environment.",https://a0.muscache.com/pictures/miso/Hosting-112538/original/c217a155-e942-47d4-963e-3021173006fb.jpeg,567180,https://www.airbnb.com/users/show/567180,Sandra,2011-05-08,"Barcelona, Spain"," Suite Home Sagrada Familia is a complex of apartments with 12 years of experience. ""Welcome to your home” is our slogan, but we will go beyond that. Our fantastic team will be delighted to make you feel like a local with insider’s tips and doing their best to fulfill your special requests. We are always there when you need us!
What's the best way to live a real Barcelona experience? Make it unforgettable living in the heart of the city having amazing views of the work-in-progress cathedral right from your living room window or from our rooftop terrace! 
Our 100 square meter apartments can accommodate up to 6-8 people. It doesn’t matter if you are a group of friends who want to meet the city or a family that would love to explore the local culture - Suite Home Sagrada Familia is the place for you!",within an hour,100%,97%,f,https://a0.muscache.com/im/pictures/user/7aaeb41d-1ee2-48cb-927a-c39c0868eb7d.jpg?aki_policy=profile_small,https://a0.muscache.com/im/pictures/user/7aaeb41d-1ee2-48cb-927a-c39c0868eb7d.jpg?aki_policy=profile_x_medium,la Sagrada Familia,19,19,"['email', 'phone']",t,t,"Barcelona, Catalonia, Spain",la Sagrada Família,Eixample,41.40653,2.1746,Entire rental unit,Entire home/apt,8,2.0,2 baths,3,6,"[""Window guards"", ""Kitchen"", ""Dining table"", ""First aid kit"", ""Elevator"", ""Room-darkening shades"", ""Extra pillows and blankets"", ""Hair dryer"", ""Exterior security cameras on property"", ""Long term stays allowed"", ""Essentials"", ""Hot water kettle"", ""Cleaning available during stay"", ""Crib - available upon request"", ""Cooking basics"", ""Toaster"", ""Outdoor dining area"", ""Pack \u2019n play/Travel crib - available upon request"", ""Refrigerator"", ""Pocket wifi"", ""Self check-in"", ""Shampoo"", ""Standalone high chair - available upon request"", ""Freezer"", ""Shared patio or balcony"", ""Keypad"", ""Drying rack for clothing"", ""Bathtub"", ""Luggage dropoff allowed"", ""Park view"", ""Free washer \u2013 In unit"", ""Hangers"", ""Exercise equipment: elliptical, stationary bike, treadmill, yoga mat"", ""Iron"", ""Fire extinguisher"", ""Dishes and silverware"", ""Shower gel"", ""Dishwasher"", ""Bed linens"", ""Wifi"", ""Stove"", ""Central air conditioning"", ""Dedicated workspace"", ""Hot water"", ""Central heating"", ""Coffee"", ""Paid parking off premises"", ""Oven"", ""Outdoor furniture"", ""Beach access \u2013 Beachfront"", ""Smoke alarm"", ""Microwave"", ""Coffee maker: espresso machine"", ""Clothing storage: closet and dresser"", ""TV"", ""Shared gym in building"", ""Body soap"", ""Safe""]",$588.00,2,32,2,4,32,32,2.6,32.0,,t,10,32,61,104,2024-06-15,125,13,0,2011-06-21,2024-05-05,4.41,4.47,4.54,4.6,4.6,4.84,4.38,HUTB-000333,f,19,19,0,0,0.79
335861,https://www.airbnb.com/rooms/335861,20240615011618,2024-06-15,city scrape,Modern Flat,"Beautiful 2 bedroom apartment, close to the city center just 5 minutes by metro. 4 blocks from the beach.<br />The apartment is located in one of the liveliest neighborhoods of the city, combines beach, beautiful restaurants, tranquility and security.<br />Well located and well connected to the city centre<br /><br />Tourist tax 5 euros per person per night for the first 7 nights. Children under 16 are excluded. <br />Supplies 5 eur x person and night after 3rd night","You can walk to the beach which is only 3 blocks from the apartment.<br />The subway station is on the corner of the apartment.<br />By metro you can reach the city center in 5 stops (5 minutes).<br />The area is nice and quiet, but if you walk to Rambla Poble Nou (which is 5 blocks from the apartment) you get to a busy street with shops, cafes, restaurants and lots of life.<br /><br />There are 2 large shopping malls not far from the apartment (walking distance is 10 minutes to 20 minutes)<br /><br />The Olympic Port with many restaurants and lots of nightlife is also close to the apartment, just 2 metro stations or 15 minutes walk.",https://a0.muscache.com/pictures/8624ec0b-94aa-400f-9cdb-6873ff2e2b6d.jpg,1221038,https://www.airbnb.com/users/show/1221038,Mar,2011-09-28,"Callao Salvaje, Spain","I am a person who likes to travel, friendly and easy going.
I like that people that stays in my apartments in Barcelona or Tenerife have a great time.
 Im happy to offer all the assistance that you need.

If you would like to have another experience different than flat rental I can offer you the joy of experience wild life in a camper van.
I run travel agency that coordinates volunteering programs so you travel with a meaning",within an hour,100%,99%,f,https://a0.muscache.com/im/pictures/user/d49c81d4-d140-4e38-8e59-43977e181213.jpg?aki_policy=profile_small,https://a0.muscache.com/im/pictures/user/d49c81d4-d140-4e38-8e59-43977e181213.jpg?aki_policy=profile_x_medium,El Poblenou,5,7,"['email', 'phone']",t,t,"Barcelona, Catalonia, Spain",el Poblenou,Sant Martí,41.40349,2.20414,Entire rental unit,Entire home/apt,5,1.0,1 bath,2,3,"[""Kitchen"", ""Dining table"", ""Dryer"", ""Room-darkening shades"", ""Crib"", ""Hair dryer"", ""Long term stays allowed"", ""Coffee maker"", ""Essentials"", ""Hot water kettle"", ""Private patio or balcony"", ""Cleaning available during stay"", ""Portable fans"", ""Cooking basics"", ""Waterfront"", ""Wine glasses"", ""Toaster"", ""Blender"", ""Refrigerator"", ""Self check-in"", ""Shampoo"", ""Freezer"", ""Drying rack for clothing"", ""Luggage dropoff allowed"", ""Hangers"", ""Free washer \u2013 In unit"", ""Dishwasher"", ""Iron"", ""Dishes and silverware"", ""Laundromat nearby"", ""Shower gel"", ""Ceiling fan"", ""Bed linens"", ""Wifi"", ""Heating"", ""Stove"", ""Paid street parking off premises"", ""Dedicated workspace"", ""Hot water"", ""Coffee"", ""Oven"", ""Mara blaca body soap"", ""Clothing storage: closet"", ""Smart lock"", ""Microwave"", ""TV""]",$193.00,1,1125,1,1,1125,1125,1.0,1125.0,,t,6,11,34,293,2024-06-15,114,16,3,2012-07-07,2024-06-13,4.17,4.3,3.96,4.63,4.65,4.41,4.08,HUTB-007075,t,3,3,0,0,0.78
117010,https://www.airbnb.com/rooms/117010,20240615011618,2024-06-15,city scrape,✨Spacious Flat near Sagrada Familia/Shared terrace,Have an authentic Barcelona experience! Modern 100m2 recently decorated apartment - definitely one to consider if you want to soak up the spanish sunshine during your stay. An incredible location + spacious and comfortable rooms - makes it a great place to kick back and relax after a day full of sightseeing and entertainment. It doesn’t matter if you are a group of friends who wants to meet the city or a family that would love to explore the local culture- it's the place for you!,"Apartment is located just 240 meters from Sagrada Familia. Right on Avenida Gaudí, a cozy boulevard that leads from Sagrada Familia to Hospital de Sant Pau (which is another architectural wonder, a UNESCO World Heritage Site).<br />Eixample is one of the safest areas of Barcelona and at the same time has many restaurants, bars and nightclubs to enjoy, a large number of them are located on our street, where you can eat in one of the many restaurants or just sit on the avenue and enjoy local tapas. There are different environments found in this neighborhood of Barcelona, ​​from the most traditional and Catalan to a young and art-filled environment.",https://a0.muscache.com/pictures/hosting/Hosting-U3RheVN1cHBseUxpc3Rpbmc6MTE3MDEw/original/bf8eca23-2a3d-40ff-8336-fe0b5ae703f0.jpeg,567180,https://www.airbnb.com/users/show/567180,Sandra,2011-05-08,"Barcelona, Spain"," Suite Home Sagrada Familia is a complex of apartments with 12 years of experience. ""Welcome to your home” is our slogan, but we will go beyond that. Our fantastic team will be delighted to make you feel like a local with insider’s tips and doing their best to fulfill your special requests. We are always there when you need us!
What's the best way to live a real Barcelona experience? Make it unforgettable living in the heart of the city having amazing views of the work-in-progress cathedral right from your living room window or from our rooftop terrace! 
Our 100 square meter apartments can accommodate up to 6-8 people. It doesn’t matter if you are a group of friends who want to meet the city or a family that would love to explore the local culture - Suite Home Sagrada Familia is the place for you!",within an hour,100%,97%,f,https://a0.muscache.com/im/pictures/user/7aaeb41d-1ee2-48cb-927a-c39c0868eb7d.jpg?aki_policy=profile_small,https://a0.muscache.com/im/pictures/user/7aaeb41d-1ee2-48cb-927a-c39c0868eb7d.jpg?aki_policy=profile_x_medium,la Sagrada Familia,19,19,"['email', 'phone']",t,t,"Barcelona, Catalonia, Spain",la Sagrada Família,Eixample,41.40647,2.17457,Entire rental unit,Entire home/apt,8,2.0,2 baths,3,6,"[""Window guards"", ""Kitchen"", ""Dining table"", ""First aid kit"", ""City skyline view"", ""Elevator"", ""Room-darkening shades"", ""Extra pillows and blankets"", ""Hair dryer"", ""Exterior security cameras on property"", ""Long term stays allowed"", ""Coffee maker"", ""Hot water kettle"", ""Cleaning available during stay"", ""Crib - available upon request"", ""Cooking basics"", ""Toaster"", ""Pack \u2019n play/Travel crib - available upon request"", ""Refrigerator"", ""Beach view"", ""Pocket wifi"", ""Self check-in"", ""Shampoo"", ""Standalone high chair - available upon request"", ""Freezer"", ""Keypad"", ""Paid parking on premises"", ""Drying rack for clothing"", ""Luggage dropoff allowed"", ""Hangers"", ""Free washer \u2013 In unit"", ""Exercise equipment: elliptical, stationary bike, treadmill, yoga mat"", ""Iron"", ""Fire extinguisher"", ""Dishes and silverware"", ""Shower gel"", ""HDTV"", ""Dishwasher"", ""Bed linens"", ""Mountain view"", ""Wifi"", ""Stove"", ""Central air conditioning"", ""Dedicated workspace"", ""Central heating"", ""Coffee"", ""Paid parking off premises"", ""Oven"", ""Beach access \u2013 Beachfront"", ""Ocean view"", ""Smoke alarm"", ""Microwave"", ""Clothing storage: closet and dresser"", ""Hot water"", ""Shared gym in building"", ""Body soap"", ""Safe""]",$516.00,2,30,2,4,30,30,2.5,30.0,,t,4,29,57,72,2024-06-15,52,8,0,2011-08-09,2024-05-12,4.58,4.62,4.6,4.8,4.9,4.86,4.6,HUTB000331,f,19,19,0,0,0.33
118228,https://www.airbnb.com/rooms/118228,20240615011618,2024-06-15,city scrape,✨Bright apt views Sagrada Familia / Shared terrace,"Modern 100m2 recently decorated apartment with balconies and Sagrada Familia view. An incredible location+a direct view of Antoni Gaudí´s masterpiece right from your balcony-what a way to start the day over home prepared breakfast! Or meet the sunset with a glass of wine after a day full of sightseeing and entertainment. It doesn’t matter if you are a group of friends who wants to meet the city or a family that would love to explore the local culture-it's the place for you, ideal to feel at home","Apartment is located just 240 meters from Sagrada Familia. Right on Avenida Gaudí, a cozy boulevard that leads from Sagrada Familia to Hospital de Sant Pau (which is another architectural wonder, a UNESCO World Heritage Site).<br />Eixample is one of the safest areas of Barcelona and at the same time has many restaurants, bars and nightclubs to enjoy, a large number of them are located on our street, where you can eat in one of the many restaurants or just sit on the avenue and enjoy local tapas. There are different environments found in this neighborhood of Barcelona, ​​from the most traditional and Catalan to a young and art-filled environment.",https://a0.muscache.com/pictures/miso/Hosting-118228/original/65f3ffa7-da05-4ca6-832d-5daa23b23957.jpeg,567180,https://www.airbnb.com/users/show/567180,Sandra,2011-05-08,"Barcelona, Spain"," Suite Home Sagrada Familia is a complex of apartments with 12 years of experience. ""Welcome to your home” is our slogan, but we will go beyond that. Our fantastic team will be delighted to make you feel like a local with insider’s tips and doing their best to fulfill your special requests. We are always there when you need us!
What's the best way to live a real Barcelona experience? Make it unforgettable living in the heart of the city having amazing views of the work-in-progress cathedral right from your living room window or from our rooftop terrace! 
Our 100 square meter apartments can accommodate up to 6-8 people. It doesn’t matter if you are a group of friends who want to meet the city or a family that would love to explore the local culture - Suite Home Sagrada Familia is the place for you!",within an hour,100%,97%,f,https://a0.muscache.com/im/pictures/user/7aaeb41d-1ee2-48cb-927a-c39c0868eb7d.jpg?aki_policy=profile_small,https://a0.muscache.com/im/pictures/user/7aaeb41d-1ee2-48cb-927a-c39c0868eb7d.jpg?aki_policy=profile_x_medium,la Sagrada Familia,19,19,"['email', 'phone']",t,t,"Barcelona, Catalonia, Spain",la Sagrada Família,Eixample,41.40653,2.1746,Entire rental unit,Entire home/apt,8,2.0,2 baths,3,5,"[""Window guards"", ""Cleaning products"", ""Kitchen"", ""Dining table"", ""First aid kit"", ""City skyline view"", ""Elevator"", ""Room-darkening shades"", ""Carbon monoxide alarm"", ""Extra pillows and blankets"", ""Hair dryer"", ""Exterior security cameras on property"", ""Long term stays allowed"", ""Essentials"", ""Hot water kettle"", ""Private patio or balcony"", ""Cleaning available during stay"", ""Private backyard \u2013 Fully fenced"", ""Crib - available upon request"", ""Cooking basics"", ""Toaster"", ""Outdoor dining area"", ""Pack \u2019n play/Travel crib - available upon request"", ""Refrigerator"", ""Pocket wifi"", ""Self check-in"", ""Shampoo"", ""Standalone high chair - available upon request"", ""Freezer"", ""Keypad"", ""Drying rack for clothing"", ""Children\u2019s dinnerware"", ""Luggage dropoff allowed"", ""Hangers"", ""Free washer \u2013 In unit"", ""Exercise equipment: elliptical, stationary bike, treadmill, yoga mat"", ""Iron"", ""Fire extinguisher"", ""Dishes and silverware"", ""Shower gel"", ""Dishwasher"", ""Bed linens"", ""Wifi"", ""Stove"", ""Central air conditioning"", ""Dedicated workspace"", ""Hot water"", ""Central heating"", ""Coffee"", ""Paid parking off premises"", ""Garden view"", ""Oven"", ""Beach access \u2013 Beachfront"", ""Outdoor furniture"", ""Smoke alarm"", ""Microwave"", ""Coffee maker: espresso machine"", ""Clothing storage: closet and dresser"", ""TV"", ""Shared gym in building"", ""Body soap"", ""Safe""]",$534.00,2,28,2,4,28,28,2.6,28.0,,t,9,31,61,104,2024-06-15,60,12,1,2011-09-13,2024-05-28,4.6,4.52,4.63,4.6,4.77,4.9,4.55,HUTB-000328,f,19,19,0,0,0.39
337755,https://www.airbnb.com/rooms/337755,20240615011618,2024-06-15,city scrape,SEALONA VILA OLIMPICA BEACH,,,https://a0.muscache.com/pictures/3692192/234478e3_original.jpg,1716315,https://www.airbnb.com/users/show/1716315,Marc,2012-02-07,"Barcelona, Spain",Salut!,within an hour,100%,100%,t,https://a0.muscache.com/im/pictures/user/e4629024-79b4-481c-99cd-b07ac81baa1d.jpg?aki_policy=profile_small,https://a0.muscache.com/im/pictures/user/e4629024-79b4-481c-99cd-b07ac81baa1d.jpg?aki_policy=profile_x_medium,La Vila Olímpica,12,15,"['email', 'phone']",t,t,,la Vila Olímpica del Poblenou,Sant Martí,41.39253234863281,2.19325590133667,Entire rental unit,Entire home/apt,4,1.0,1 bath,1,2,"[""Cleaning products"", ""Kitchen"", ""Dining table"", ""Elevator"", ""Room-darkening shades"", ""Coffee maker: Nespresso"", ""Extra pillows and blankets"", ""Hair dryer"", ""Long term stays allowed"", ""Essentials"", ""Hot water kettle"", ""Private patio or balcony"", ""Private backyard \u2013 Fully fenced"", ""Cooking basics"", ""Stainless steel oven"", ""Wine glasses"", ""Toaster"", ""Pack \u2019n play/Travel crib - available upon request"", ""Refrigerator"", ""Shampoo"", ""Baby bath - available upon request"", ""Freezer"", ""Drying rack for clothing"", ""Bathtub"", ""Hangers"", ""Free washer \u2013 In unit"", ""Dishwasher"", ""Iron"", ""Dishes and silverware"", ""Shower gel"", ""Bed linens"", ""Wifi"", ""Stove"", ""Central air conditioning"", ""Free dryer \u2013 In unit"", ""Hot water"", ""Central heating"", ""Paid parking garage on premises \u2013 1 space"", ""Outdoor furniture"", ""Clothing storage: closet"", ""Folding or convertible high chair - available upon request"", ""Baking sheet"", ""Microwave"", ""Shared beach access"", ""Bidet"", ""Shared outdoor pool - available all year"", ""Single level home"", ""TV"", ""Body soap"", ""Pets allowed"", ""Outdoor dining area""]",$249.00,1,365,1,10,1125,1125,3.6,1125.0,,t,7,21,46,134,2024-06-15,65,18,2,2014-05-09,2024-05-28,4.63,4.66,4.34,4.98,4.98,4.82,4.25,HUTB-002887,t,12,12,0,0,0.53
128463,https://www.airbnb.com/rooms/128463,20240615011618,2024-06-15,city scrape,Private Suite in residential area!!,"My House is located in the quiet district of Sants, catalan typical neighborhood. It is very close to the metro and bus, and just 10 minutes to the Centre. It is a quiet neighborhood, and cheaper than the Center. There are many restaurants and bars..","You live in a typical Spanish district with not so many tourists but very close to the metro station, train station and busses. You are in few minutes in the city centre. In the neighbourhood you have many shops, cafés and restaurants. People are very nice and helpful.",https://a0.muscache.com/pictures/855084/c71b6596_original.jpg,635253,https://www.airbnb.com/users/show/635253,Sebastian,2011-05-28,"L'Hospitalet de l'Infant, Spain","Hola!! 
I am from Argentina who has lived in BCN for 26 years now. I am quiet, friendly and a great host. 
My intention is to make you feel at home, so my clean and tidy apartment is yours to enjoy. The apartment is situated in a nice and safe area.
So enjoy Bnc and good luck in your search!
Sebastian",within an hour,100%,100%,t,https://a0.muscache.com/im/pictures/user/0efc23d2-54f4-47fc-89f1-ee2119311277.jpg?aki_policy=profile_small,https://a0.muscache.com/im/pictures/user/0efc23d2-54f4-47fc-89f1-ee2119311277.jpg?aki_policy=profile_x_medium,Sants-Montjuïc,1,1,"['email', 'phone']",t,t,"Barcelona, Catalonia, Spain",Sants,Sants-Montjuïc,41.37155,2.13664,Entire rental unit,Entire home/apt,2,2.0,2 baths,1,1,"[""Cleaning products"", ""Kitchen"", ""Dining table"", ""First aid kit"", ""Carbon monoxide alarm"", ""Otro induction stove"", ""Coffee maker: Nespresso"", ""Extra pillows and blankets"", ""Hair dryer"", ""Exterior security cameras on property"", ""AC - split type ductless system"", ""Long term stays allowed"", ""Essentials"", ""Hot water kettle"", ""Private patio or balcony"", ""Private backyard \u2013 Fully fenced"", ""Portable fans"", ""Cooking basics"", ""Wine glasses"", ""Toaster"", ""Private entrance"", ""Refrigerator"", ""Shampoo"", ""Freezer"", ""Paid parking lot off premises"", ""45 inch HDTV with standard cable, Amazon Prime Video"", ""Drying rack for clothing"", ""Bathtub"", ""Hangers"", ""Crib - always at the listing"", ""Iron"", ""Dishes and silverware"", ""Laundromat nearby"", ""Shower gel"", ""Bed linens"", ""Wifi"", ""Dedicated workspace"", ""Coffee"", ""Oven"", ""Outdoor furniture"", ""Clothing storage: closet"", ""Smoke alarm"", ""Radiant heating"", ""Rice maker"", ""Microwave"", ""Bidet"", ""Hot water"", ""Body soap""]",$117.00,3,1125,1,3,1125,1125,3.0,1125.0,,t,11,16,29,277,2024-06-15,423,46,4,2011-09-03,2024-06-09,4.85,4.89,4.94,4.94,4.9,4.72,4.81,HUTB-012603,f,1,1,0,0,2.72
