174382,https://www.airbnb.com/rooms/174382,20240615011618,2024-06-15,city scrape,🌟Central Flat near Sagrada Familia/Shared terrace,Have an authentic Barcelona experience! Modern 100m2 apartment - definitely one to consider if you want to soak up the spanish sunshine during your stay. An incredible location + spacious and comfortable rooms - makes it a great place to kick back and relax after a day full of sightseeing and entertainment. It doesn’t matter if you are a group of friends who wants to meet the city or a family that would love to explore the local culture- it's the place for you!,"Apartment is located just 240 meters from Sagrada Familia. Right on Avenida Gaudí, a cozy boulevard that leads from Sagrada Familia to Hospital de Sant Pau (which is another architectural wonder, a UNESCO World Heritage Site).<br />Eixample is one of the safest areas of Barcelona and at the same time has many restaurants, bars and nightclubs to enjoy, a large number of them are located on our street, where you can eat in one of the many restaurants or just sit on the avenue and enjoy local tapas. There are different environments found in this neighborhood of Barcelona, ​​from the most traditional and Catalan to a young and art-filled environment.",https://a0.muscache.com/pictures/hosting/Hosting-U3RheVN1cHBseUxpc3Rpbmc6MTc0Mzgy/original/77983e8c-bd29-44b8-b242-930bc2fecf44.jpeg,567180,https://www.airbnb.com/users/show/567180,Sandra,2011-05-08,"Barcelona, Spain"," Suite Home Sagrada Familia is a complex of apartments with 12 years of experience. ""Welcome to your home” is our slogan, but we will go beyond that. Our fantastic team will be delighted to make you feel like a local with insider’s tips and doing their best to fulfill your special requests. We are always there when you need us!
What's the best way to live a real Barcelona experience? Make it unforgettable living in the heart of the city having amazing views of the work-in-progress cathedral right from your living room window or from our rooftop terrace! 
Our 100 square meter apartments can accommodate up to 6-8 people. It doesn’t matter if you are a group of friends who want to meet the city or a family that would love to explore the local culture - Suite Home Sagrada Familia is the place for you!",within an hour,100%,97%,f,https://a0.muscache.com/im/pictures/user/7aaeb41d-1ee2-48cb-927a-c39c0868eb7d.jpg?aki_policy=profile_small,https://a0.muscache.com/im/pictures/user/7aaeb41d-1ee2-48cb-927a-c39c0868eb7d.jpg?aki_policy=profile_x_medium,la Sagrada Familia,19,19,"['email', 'phone']",t,t,"Barcelona, Catalonia, Spain",la Sagrada Família,Eixample,41.40653,2.17455,Entire rental unit,Entire home/apt,8,1.0,1 bath,3,6,"[""Window guards"", ""Cleaning products"", ""Kitchen"", ""Dining table"", ""First aid kit"", ""City skyline view"", ""Elevator"", ""Room-darkening shades"", ""Extra pillows and blankets"", ""Hair dryer"", ""Exterior security cameras on property"", ""Long term stays allowed"", ""Essentials"", ""Hot water kettle"", ""Cleaning available during stay"", ""Crib - available upon request"", ""Cooking basics"", ""Toaster"", ""Pack \u2019n play/Travel crib - available upon request"", ""Refrigerator"", ""Pocket wifi"", ""Self check-in"", ""Shampoo"", ""Standalone high chair - available upon request"", ""Freezer"", ""Keypad"", ""Drying rack for clothing"", ""Children\u2019s dinnerware"", ""Luggage dropoff allowed"", ""Hangers"", ""Free washer \u2013 In unit"", ""Exercise equipment: elliptical, stationary bike, treadmill, yoga mat"", ""Iron"", ""Fire extinguisher"", ""Dishes and silverware"", ""Shower gel"", ""HDTV"", ""Dishwasher"", ""Bed linens"", ""Wifi"", ""Stove"", ""Central air conditioning"", ""Dedicated workspace"", ""Central heating"", ""Coffee"", ""Paid parking off premises"", ""Garden view"", ""Oven"", ""Beach access \u2013 Beachfront"", ""Smoke alarm"", ""Microwave"", ""Coffee maker: espresso machine"", ""Clothing storage: closet and dresser"", ""Hot water"", ""Shared gym in building"", ""Body soap"", ""Safe""]",$433.00,2,28,2,4,28,28,2.5,28.0,,t,5,14,38,53,2024-06-15,29,11,1,2015-10-18,2024-05-27,4.38,4.45,4.45,4.62,4.59,4.79,4.38,HUTB000327,f,19,19,0,0,0.27
188267,https://www.airbnb.com/rooms/188267,20240615011618,2024-06-15,city scrape,"LAST Minute Promotion ,Balconies  and views, city","Welcome to Watermelon Barcelona community. The apartment you are about to book has everything you need for a top quality stay. <br />We have more than 10 years providing people around the world the perfect home away from home, so relax and enjoy, you are on the perfect hands now.","Finding a cab is easy here, and there are also three nearby metro stations--Tetuan, Arc de Triomf, and Urquinaona. Nearby sites such as Casa Calvet and the Sagrada Família are easy to find even if walking.",https://a0.muscache.com/pictures/01c6a225-0af8-411c-934c-c5559fe5cab5.jpg,366654,https://www.airbnb.com/users/show/366654,Watermelon Barcelona Apartments,2011-01-28,"Barcelona, Spain","I have a lot of Travel and hosting experience.
I am a Publisher in Architecture & Interior Design books.",within an hour,100%,95%,f,https://a0.muscache.com/im/users/366654/profile_pic/1296302798/original.jpg?aki_policy=profile_small,https://a0.muscache.com/im/users/366654/profile_pic/1296302798/original.jpg?aki_policy=profile_x_medium,Dreta de l'Eixample,3,18,"['email', 'phone', 'work_email']",t,f,"Barcelona, Catalonia, Spain",la Dreta de l'Eixample,Eixample,41.39258,2.17692,Entire rental unit,Entire home/apt,6,2.0,2 baths,3,4,"[""Kitchen"", ""Dryer"", ""First aid kit"", ""Host greets you"", ""Crib"", ""Hair dryer"", ""Air conditioning"", ""Long term stays allowed"", ""Coffee maker"", ""TV with standard cable"", ""Essentials"", ""Cooking basics"", ""Washer"", ""Refrigerator"", ""Shampoo"", ""Shared patio or balcony"", ""Luggage dropoff allowed"", ""Hangers"", ""Dishwasher"", ""Iron"", ""Dishes and silverware"", ""Wifi"", ""Heating"", ""Stove"", ""Dedicated workspace"", ""Paid parking off premises"", ""Oven"", ""Smoke alarm"", ""Microwave"", ""High chair"", ""Hot water""]",$411.00,2,730,2,2,730,730,2.0,730.0,,t,16,41,71,162,2024-06-15,120,15,0,2011-10-11,2024-05-14,4.69,4.62,4.87,4.88,4.82,4.83,4.52,hutb-005119,t,3,3,0,0,0.78
346018,https://www.airbnb.com/rooms/346018,20240615011618,2024-06-15,city scrape,Room in a flat with Barcelona best view!,"Hi, I rent a room in a duplex in front of Barcelona Central park. Ask if you need the second room.<br />All the spaces are very sunny and quiet with an amazing view of the city, something that you can not find in other listings. You will also enjoy the living room looking to the sunset, the sea of the America Cup and the lights of the city. You can even have a shower in the morning looking to the sunrise in the sea.",It is in center but it is quite and the park in the front is great. Barcelona centre is almost no more liveable due to noise and a lot of tourist.,https://a0.muscache.com/pictures/3e49a17c-9cea-4701-8006-80883265fd96.jpg,1753990,https://www.airbnb.com/users/show/1753990,Filippo,2012-02-15,"Barcelona, Spain","Architect and photographer, if you have any questions, don't hesitate to contact me.",within an hour,100%,25%,f,https://a0.muscache.com/im/users/1753990/profile_pic/1391771921/original.jpg?aki_policy=profile_small,https://a0.muscache.com/im/users/1753990/profile_pic/1391771921/original.jpg?aki_policy=profile_x_medium,Glòries - El Parc,3,4,"['email', 'phone', 'work_email']",t,t,"Barcelona, Catalonia, Spain",el Parc i la Llacuna del Poblenou,Sant Martí,41.3922,2.18805,Private room in rental unit,Private room,4,1.5,1.5 shared baths,1,1,"[""Kitchen"", ""Park view"", ""Hangers"", ""City skyline view"", ""Elevator"", ""Sea view"", ""Iron"", ""Washer"", ""Fire extinguisher"", ""Host greets you"", ""Hair dryer"", ""Wifi"", ""Heating"", ""Shampoo"", ""Essentials"", ""Hot water""]",$200.00,7,210,7,7,210,210,7.0,210.0,,t,23,53,83,358,2024-06-15,17,0,0,2012-05-15,2019-10-09,4.76,5.0,5.0,5.0,5.0,5.0,5.0,Exempt,f,1,0,1,0,0.12
190348,https://www.airbnb.com/rooms/190348,20240615011618,2024-06-15,previous scrape,Apartment with large terrace,,,https://a0.muscache.com/pictures/fd58c265-ddfc-46de-8676-b0b7a1bf0abc.jpg,919480,https://www.airbnb.com/users/show/919480,Elisa,2011-08-04,"Barcelona, Spain","",N/A,N/A,N/A,f,https://a0.muscache.com/im/users/919480/profile_pic/1312446387/original.jpg?aki_policy=profile_small,https://a0.muscache.com/im/users/919480/profile_pic/1312446387/original.jpg?aki_policy=profile_x_medium,Pedralbes,1,2,"['email', 'phone']",t,t,,Pedralbes,Les Corts,41.38893,2.12443,Private room in rental unit,Private room,2,,1 bath,,,"[""Kitchen"", ""Free parking on premises"", ""Dryer"", ""Elevator"", ""Pool"", ""Washer"", ""Smoking allowed"", ""Wifi"", ""Air conditioning"", ""Heating"", ""TV with standard cable"", ""Pets allowed""]",,7,15,7,7,15,15,7.0,15.0,,t,0,0,0,0,2024-06-15,1,0,0,2016-06-09,2016-06-09,5.0,5.0,5.0,4.0,5.0,5.0,5.0,,f,1,0,1,0,0.01
196021,https://www.airbnb.com/rooms/196021,20240615011618,2024-06-15,city scrape,"Large patio, 4 baths (3 en-suite), 19th c, central","Centraly located but in an area with few tourists but many restaurants, bars and shops, including everyday life shops, so you feel like part of the city life. Charming 19th century apartment with lovely patio with several subway and bus lines that take you to the beach or to other more remote parts of the city. I´m always just a phone call away so you feel not alone...","Traditional 19th century building in the Eixample district, very central in an area with a great selection of restaurants and bars, close to public transport and with many shops and supermarkets nearby. You are close to tourist sites, but in an area where you will mostly see locals in the streets and shops.",https://a0.muscache.com/pictures/ac4d99c2-5f66-468a-ac62-3b422480f5db.jpg,953719,https://www.airbnb.com/users/show/953719,Julia,2011-08-10,"Barcelona, Spain","",within an hour,100%,82%,t,https://a0.muscache.com/im/users/953719/profile_pic/1318254013/original.jpg?aki_policy=profile_small,https://a0.muscache.com/im/users/953719/profile_pic/1318254013/original.jpg?aki_policy=profile_x_medium,La Nova Esquerra de l'Eixample,3,11,"['email', 'phone']",t,t,"Barcelona, Catalonia, Spain",l'Antiga Esquerra de l'Eixample,Eixample,41.38842,2.16108,Entire rental unit,Entire home/apt,8,4.0,4 baths,4,5,"[""Pack \u2019n play/Travel crib"", ""Courtyard view"", ""Cleaning products"", ""Outlet covers"", ""Kitchen"", ""Dining table"", ""Elevator"", ""Host greets you"", ""Room-darkening shades"", ""Carbon monoxide alarm"", ""Crib"", ""Beach essentials"", ""Extra pillows and blankets"", ""Hair dryer"", ""Essentials"", ""Hot water kettle"", ""Private patio or balcony"", ""Private backyard \u2013 Fully fenced"", ""Cooking basics"", ""Wine glasses"", ""Board games"", ""Toaster"", ""Blender"", ""Refrigerator"", ""42 inch HDTV with Netflix, Amazon Prime Video, standard cable"", ""Shampoo"", ""Freezer"", ""Drying rack for clothing"", ""Bathtub"", ""Children\u2019s dinnerware"", ""Hangers"", ""Free washer \u2013 In unit"", ""Children\u2019s books and toys"", ""Luggage dropoff allowed"", ""Dishwasher"", ""Iron"", ""Conditioner"", ""Fire extinguisher"", ""Shower gel"", ""Dishes and silverware"", ""Laundromat nearby"", ""Bed linens"", ""Smoking allowed"", ""Wifi"", ""Coffee maker: Nespresso, pour-over coffee"", ""Heating"", ""Stove"", ""Central air conditioning"", ""Free dryer \u2013 In unit"", ""Dedicated workspace"", ""Coffee"", ""Paid parking off premises"", ""Oven"", ""Outdoor furniture"", ""Clothing storage: closet"", ""Smoke alarm"", ""Rice maker"", ""Microwave"", ""High chair"", ""Hot water"", ""Body soap"", ""Outdoor dining area""]",$671.00,2,27,1,8,27,27,4.7,27.0,,t,1,13,19,225,2024-06-15,417,54,4,2011-09-28,2024-06-09,4.95,4.92,4.91,4.99,4.96,4.93,4.9,HUTB-506707,f,2,2,0,0,2.69
196196,https://www.airbnb.com/rooms/196196,20240615011618,2024-06-15,city scrape,✨Large Apt near Sagrada Familia / Shared terrace✨,Have an authentic Barcelona experience! Modern 100m2 apartment with a balcony- definitely one to consider if you want to soak up the spanish sunshine during your stay. An incredible location + spacious and comfortable rooms - makes it a great place to kick back and relax after a day full of sightseeing and entertainment. It doesn’t matter if you are a group of friends who wants to meet the city or a family that would love to explore the local culture- it's the place for you!,"Apartment is located just 240 meters from Sagrada Familia. Right on Avenida Gaudí, a cozy boulevard that leads from Sagrada Familia to Hospital de Sant Pau (which is another architectural wonder, a UNESCO World Heritage Site).<br />Eixample is one of the safest areas of Barcelona and at the same time has many restaurants, bars and nightclubs to enjoy, a large number of them are located on our street, where you can eat in one of the many restaurants or just sit on the avenue and enjoy local tapas. There are different environments found in this neighborhood of Barcelona, ​​from the most traditional and Catalan to a young and art-filled environment.",https://a0.muscache.com/pictures/hosting/Hosting-U3RheVN1cHBseUxpc3Rpbmc6MTk2MTk2/original/5c63e480-4cef-4eed-b56b-1283f5980fc1.jpeg,567180,https://www.airbnb.com/users/show/567180,Sandra,2011-05-08,"Barcelona, Spain"," Suite Home Sagrada Familia is a complex of apartments with 12 years of experience. ""Welcome to your home” is our slogan, but we will go beyond that. Our fantastic team will be delighted to make you feel like a local with insider’s tips and doing their best to fulfill your special requests. We are always there when you need us!
What's the best way to live a real Barcelona experience? Make it unforgettable living in the heart of the city having amazing views of the work-in-progress cathedral right from your living room window or from our rooftop terrace! 
Our 100 square meter apartments can accommodate up to 6-8 people. It doesn’t matter if you are a group of friends who want to meet the city or a family that would love to explore the local culture - Suite Home Sagrada Familia is the place for you!",within an hour,100%,97%,f,https://a0.muscache.com/im/pictures/user/7aaeb41d-1ee2-48cb-927a-c39c0868eb7d.jpg?aki_policy=profile_small,https://a0.muscache.com/im/pictures/user/7aaeb41d-1ee2-48cb-927a-c39c0868eb7d.jpg?aki_policy=profile_x_medium,la Sagrada Familia,19,19,"['email', 'phone']",t,t,"Barcelona, Catalonia, Spain",la Sagrada Família,Eixample,41.4066,2.17459,Entire rental unit,Entire home/apt,8,2.0,2 baths,4,7,"[""Window guards"", ""Cleaning products"", ""Kitchen"", ""Dining table"", ""First aid kit"", ""City skyline view"", ""Elevator"", ""Room-darkening shades"", ""Hair dryer"", ""Exterior security cameras on property"", ""Long term stays allowed"", ""Essentials"", ""Hot water kettle"", ""Private patio or balcony"", ""Cleaning available during stay"", ""Crib - available upon request"", ""Cooking basics"", ""Toaster"", ""Outdoor dining area"", ""Pack \u2019n play/Travel crib - available upon request"", ""Refrigerator"", ""Pocket wifi"", ""Self check-in"", ""Standalone high chair - available upon request"", ""Shampoo"", ""Freezer"", ""Keypad"", ""Drying rack for clothing"", ""Children\u2019s dinnerware"", ""Luggage dropoff allowed"", ""Hangers"", ""Free washer \u2013 In unit"", ""Exercise equipment: elliptical, stationary bike, treadmill, yoga mat"", ""Iron"", ""Fire extinguisher"", ""Dishes and silverware"", ""Shower gel"", ""Dishwasher"", ""Bed linens"", ""Wifi"", ""Stove"", ""Central air conditioning"", ""Hot water"", ""Central heating"", ""Coffee"", ""Paid parking off premises"", ""Oven"", ""Outdoor furniture"", ""Beach access \u2013 Beachfront"", ""Smoke alarm"", ""Microwave"", ""Coffee maker: espresso machine"", ""Clothing storage: closet and dresser"", ""TV"", ""Shared gym in building"", ""Body soap"", ""Safe""]",$483.00,2,32,2,4,1125,1125,2.5,1125.0,,t,13,37,67,85,2024-06-15,147,29,4,2011-09-15,2024-06-06,4.48,4.41,4.59,4.65,4.68,4.86,4.43,HUTB-000325,f,19,19,0,0,0.95
347824,https://www.airbnb.com/rooms/347824,20240615011618,2024-06-15,previous scrape,"bmes Ideal Happy Location Beach Area, Old Town","Beautiful charming and comfortable spacious 1 bedroom apartment located in central Barcelona, in Barceloneta, in a very nice and safe neighbourhood. This is a nice 1 bedroom apartment in a perfect location in the city!<br />2 individual beds<br />1 sofa bed<br />HUTB-00000",,https://a0.muscache.com/pictures/miso/Hosting-347824/original/3a3aa6f5-ae00-430b-91c8-15bdb28a4f5a.jpeg,1447144,https://www.airbnb.com/users/show/1447144,Acomodis Apartments,2011-11-27,"Barcelona, Spain","We are ""ACOMODIS"" apartments in Barcelona!
We are a Catalan and Venezuelan couple with 3 daughters and we started using airbnb as our personal account. But since we were getting more apartments to manage we founded our small “family agency” called “ACOMODIS”. We are part of a happy team and we all work full time managing short term rentals and organizing cooking activities. We absolutely love what we do and we are more than happy to meet amazing people from all around the world and ensure our guests enjoy this incredible city. We are happy when our guests are happy!
ACOMODIS APARTMENTS - Self-catering apartments in Barcelona - The easy and secure place to book quality vacation apartments. Always great deals, always great service from ACOMODIS!

Hola amigos,
In order to help you, I and my wife offer a wide variety of apartments in Barcelona to make it easier for you to enjoy a pleasant stay and experience.
In addition to trust us in regard to housing, we believe the most important is to have a nice experience and maximize what Barcelona has to offer. That's why we invite you to apply for any information you need before and during your stay to enjoy as ever. 
Also, if you want to enjoy a very special gastronomic activity do not hesitate to ask for information.
We speak English, French, Spanish, Catalan and on the telephone.
We are happy because we love what we do!",within a few hours,81%,19%,f,https://a0.muscache.com/im/pictures/user/f1ba627d-3c72-4140-8415-f63c7ca17a33.jpg?aki_policy=profile_small,https://a0.muscache.com/im/pictures/user/f1ba627d-3c72-4140-8415-f63c7ca17a33.jpg?aki_policy=profile_x_medium,El Poble-sec,212,393,"['email', 'phone']",t,t,,la Barceloneta,Ciutat Vella,41.3764,2.19102,Entire rental unit,Entire home/apt,3,,1 bath,1,,"[""Pack \u2019n play/Travel crib"", ""Cleaning products"", ""Kitchen"", ""Dining table"", ""Patio or balcony"", ""Crib"", ""Extra pillows and blankets"", ""Hair dryer"", ""Air conditioning"", ""Long term stays allowed"", ""Clothing storage"", ""Essentials"", ""Coffee maker"", ""Cooking basics"", ""Wine glasses"", ""Toaster"", ""Washer"", ""Refrigerator"", ""Freezer"", ""Drying rack for clothing"", ""Luggage dropoff allowed"", ""Hangers"", ""Iron"", ""Dishes and silverware"", ""Bed linens"", ""Wifi"", ""Heating"", ""Stove"", ""Dedicated workspace"", ""Hot water"", ""Paid parking off premises"", ""Microwave"", ""Shared beach access"", ""High chair"", ""TV""]",,2,1125,2,2,1125,1125,2.0,1125.0,,t,30,60,90,361,2024-06-15,3,1,0,2014-05-06,2024-02-19,4.0,4.67,4.0,2.67,3.67,5.0,4.0,,f,207,207,0,0,0.02
351395,https://www.airbnb.com/rooms/351395,20240615011618,2024-06-15,city scrape,Garden House - 3BR Apt with amazing Terrrace,"Discover a harmonious fusion of modernity and comfort, creating a serene retreat in the heart of the city. Nestled in the Eixample district, our Garden House apartment in Barcelona embodies coziness, authenticity, and genuineness. Just a leisurely stroll from Gaudi's iconic masterpiece, La Sagrada Família, it offers convenience for exploring the city and its wonders. Immerse yourself in the charm of this Catalan modernist neighborhood for a truly delightful stay.","Our Garden House is located in the Eixample, which translates as ""extension"" in recognition of its status as the newer part of the city, is a large area north of Plaça Catalunya spreading left and right of Passeig de Gracia. <br /><br />Nowadays Eixample is famous for being home to the majority of Barcelona's art nouveau masterpieces, and a high-class residential and shopping area.<br /><br />The right side of the Eixample is the older part and therefore has more of the impressive architecture, as the amazing La Sagrada Familia, less than a 8 minute walk from our Graden House but really there is not a huge difference between the two sides. <br /><br />It is a safe and residential part of the city but there is also a vibrant nightlife and a thriving café culture. Eixample is a beautiful barrio to wander round, take in the glorious architecture and people-watch from one of the many terrace cafes. However the area is very central and most other parts of the city are within walking distanc",https://a0.muscache.com/pictures/miso/Hosting-351395/original/c9dbc09f-9d45-41ab-a0f6-f5e88291975f.jpeg,1435464,https://www.airbnb.com/users/show/1435464,Jaume,2011-11-23,"Barcelona, Spain","HIstory buffs, foodies, and party animals all flock to Barcelona - and being a bit of all that myself, it's always a treat to host them all.
Plus, I like to go out and explore the city, then share all the tips with you.

Here's a few

Favourite Foodie places
Can Ravell
La Taverna del Clínic
Xàtiva
Semon Nou
Monvínic

Top Gin and Tonic spots
Bobby's Gin
Milano
Dry Martini

And of course, travelling is a well known vice of mine - so I might just see you on one of my trips and you can host me too!",within an hour,100%,92%,f,https://a0.muscache.com/im/users/1435464/profile_pic/1361384622/original.jpg?aki_policy=profile_small,https://a0.muscache.com/im/users/1435464/profile_pic/1361384622/original.jpg?aki_policy=profile_x_medium,La Nova Esquerra de l'Eixample,13,34,"['email', 'phone', 'work_email']",t,t,"Barcelona, Catalonia, Spain",el Fort Pienc,Eixample,41.39271,2.17974,Entire condo,Entire home/apt,6,2.0,2 baths,3,4,"[""Pack \u2019n play/Travel crib"", ""Cleaning products"", ""Kitchen"", ""Dining table"", ""Fast wifi \u2013 280 Mbps"", ""Elevator"", ""Room-darkening shades"", ""Carbon monoxide alarm"", ""Crib"", ""Hair dryer"", ""AC - split type ductless system"", ""Long term stays allowed"", ""Coffee maker"", ""TV with standard cable"", ""Essentials"", ""Private patio or balcony"", ""Private backyard \u2013 Fully fenced"", ""Cooking basics"", ""Outdoor dining area"", ""Refrigerator"", ""Outdoor playground"", ""Stainless steel electric stove"", ""Self check-in"", ""Shampoo"", ""Luggage dropoff allowed"", ""Hangers"", ""Free washer \u2013 In unit"", ""Children\u2019s books and toys"", ""Dishwasher"", ""Iron"", ""Dishes and silverware"", ""Building staff"", ""Bed linens"", ""Heating"", ""Free dryer \u2013 In unit"", ""Dedicated workspace"", ""Paid parking off premises"", ""Oven"", ""Outdoor furniture"", ""Smoke alarm"", ""Babysitter recommendations"", ""Microwave"", ""High chair"", ""Single level home"", ""Ethernet connection"", ""Hot water"", ""Body soap"", ""Garden view""]",$239.00,1,1125,1,3,1125,1125,2.0,1125.0,,t,4,8,15,179,2024-06-15,89,11,0,2013-06-20,2024-03-20,4.56,4.61,4.61,4.73,4.72,4.76,4.36,HUTB-009578,t,13,13,0,0,0.67
